{
  "$schema": "./schemas/page-catalog.schema.json",
  "schemaVersion": 1,
  "catalogVersion": "1.0",
  "generatedAt": "2026-09-23T00:00:00+08:00",
  "pages": [
    {
      "pageId": "create-event-main-category",
      "titleZh": "新增事件主類別",
      "titleEn": "Create Event Main Category",
      "moduleId": "database-management",
      "path": "product/v1.0/pages/create-event-main-category.md",
      "knowledgeStatus": "partial",
      "reviewStatus": "needs-review",
      "ownerTeam": "",
      "lastReviewedAt": null,
      "relatedFlowIds": ["create-event-main-category-flow"],
      "relatedCanonicalIds": [
        "create-event-main-category-step-1",
        "create-event-main-category-step-2",
        "create-event-main-category-step-3",
        "create-event-main-category-step-4-upload-image",
        "create-event-main-category-step-4-image-list"
      ],
      "claims": [
        {
          "id": "create-event-main-category-module",
          "statement": "此頁面相關 Core 元件屬於資料庫管理模組，Page Type 為 Create。",
          "status": "observed",
          "evidence": [
            { "type": "canonical-id", "ref": "create-event-main-category-step-1", "url": "https://www.figma.com/design/UX9EY190SGnpNiowHlwiUB?node-id=198-261138" }
          ]
        },
        {
          "id": "create-event-main-category-responsive",
          "statement": "相關 Step 元件提供 PC／Tablet 與 Mobile 版型。",
          "status": "observed",
          "evidence": [
            { "type": "canonical-id", "ref": "create-event-main-category-step-1", "note": "device Variant 提供 PC&Tablet 與 Mobile" }
          ]
        },
        {
          "id": "create-event-main-category-uses-step-flow",
          "statement": "此頁面應由 Step 1～4 組成單一新增流程。",
          "status": "confirmed",
          "evidence": [
            { "type": "canonical-id", "ref": "create-event-main-category-step-1" },
            { "type": "canonical-id", "ref": "create-event-main-category-step-2" },
            { "type": "canonical-id", "ref": "create-event-main-category-step-3" },
            { "type": "canonical-id", "ref": "create-event-main-category-step-4-upload-image" }
          ],
          "rationale": "canonicalId、nodeName 與 functionSummary 使用連續 Step 命名，顯示為同一新增操作的階段。",
          "reviewer": "User confirmation in Codex task",
          "reviewedAt": "2026-09-23"
        },
        {
          "id": "create-event-main-category-primary-role",
          "statement": "此頁面的主要使用角色尚未確認。",
          "status": "unknown",
          "evidence": [],
          "openQuestionId": "PQ-0001"
        },
        {
          "id": "create-event-main-category-entry-permission",
          "statement": "此頁面的進入方式與權限條件尚未確認。",
          "status": "unknown",
          "evidence": [],
          "openQuestionId": "PQ-0002"
        },
        {
          "id": "create-event-main-category-success-destination",
          "statement": "新增成功後的導向與顯示結果尚未確認。",
          "status": "unknown",
          "evidence": [],
          "openQuestionId": "PQ-0003"
        }
      ]
    },
    {
      "pageId": "edit-event-main-category",
      "titleZh": "編輯事件主類別",
      "titleEn": "Edit Event Main Category",
      "moduleId": "database-management",
      "path": "product/v1.0/pages/edit-event-main-category.md",
      "knowledgeStatus": "partial",
      "reviewStatus": "needs-review",
      "ownerTeam": "",
      "lastReviewedAt": null,
      "relatedFlowIds": ["edit-event-main-category-flow"],
      "relatedCanonicalIds": [
        "edit-event-main-category-step-1",
        "edit-event-main-category-step-2",
        "edit-event-main-category-step-3",
        "edit-event-main-category-step-4-image-list",
        "edit-event-main-category-step-4-upload-image"
      ],
      "claims": [
        {
          "id": "edit-event-main-category-module",
          "statement": "此頁面相關 Core 元件屬於資料庫管理模組。",
          "status": "observed",
          "evidence": [
            { "type": "canonical-id", "ref": "edit-event-main-category-step-1", "url": "https://www.figma.com/design/UX9EY190SGnpNiowHlwiUB?node-id=198-262047" }
          ]
        },
        {
          "id": "edit-event-main-category-responsive",
          "statement": "相關 Step 元件提供 PC／Tablet 與 Mobile 版型。",
          "status": "observed",
          "evidence": [
            { "type": "canonical-id", "ref": "edit-event-main-category-step-1", "note": "device Variant 提供 PC&Tablet 與 Mobile" }
          ]
        },
        {
          "id": "edit-event-main-category-uses-step-flow",
          "statement": "此頁面由 Step 1～4 組成單一編輯流程，且一次只顯示一個作用中的 Step。",
          "status": "confirmed",
          "evidence": [
            { "type": "canonical-id", "ref": "edit-event-main-category-step-1" },
            { "type": "canonical-id", "ref": "edit-event-main-category-step-2" },
            { "type": "canonical-id", "ref": "edit-event-main-category-step-3" },
            { "type": "canonical-id", "ref": "edit-event-main-category-step-4-upload-image" },
            { "type": "human-review", "ref": "Codex task confirmation", "note": "使用者確認四個 Step 屬於同一編輯流程，且一次只顯示一個作用中的 Step。" }
          ],
          "rationale": "連續 Step 命名形成候選流程，並已取得使用者人工確認。",
          "reviewer": "User confirmation in Codex task",
          "reviewedAt": "2026-09-23"
        },
        {
          "id": "edit-event-main-category-step-4-substates",
          "statement": "Step 4 的圖片列表與上傳圖片是同一步驟的兩種畫面狀態。",
          "status": "confirmed",
          "evidence": [
            { "type": "canonical-id", "ref": "edit-event-main-category-step-4-image-list" },
            { "type": "canonical-id", "ref": "edit-event-main-category-step-4-upload-image" },
            { "type": "human-review", "ref": "Codex task confirmation", "note": "使用者確認圖片列表與上傳圖片為 Step 4 內的兩種狀態。" }
          ],
          "rationale": "兩個 canonicalId 均標示 Step 4，且已取得使用者人工確認。",
          "reviewer": "User confirmation in Codex task",
          "reviewedAt": "2026-09-23"
        },
        {
          "id": "edit-event-main-category-primary-role",
          "statement": "此頁面的主要使用角色尚未確認。",
          "status": "unknown",
          "evidence": [],
          "openQuestionId": "PQ-0012"
        },
        {
          "id": "edit-event-main-category-entry-permission",
          "statement": "此頁面的進入方式與權限條件尚未確認。",
          "status": "unknown",
          "evidence": [],
          "openQuestionId": "PQ-0013"
        },
        {
          "id": "edit-event-main-category-success-destination",
          "statement": "編輯成功後的導向與顯示結果尚未確認。",
          "status": "unknown",
          "evidence": [],
          "openQuestionId": "PQ-0014"
        },
        {
          "id": "edit-event-main-category-source-page-type",
          "statement": "來源索引的 pageType=Create 是否應修正為編輯類型尚未確認。",
          "status": "unknown",
          "evidence": [],
          "openQuestionId": "PQ-0022"
        }
      ]
    },
    {
      "pageId": "single-parameter-update",
      "titleZh": "單一事件參數更新",
      "titleEn": "Single Parameter Update",
      "moduleId": "event-settings",
      "path": "product/v1.0/pages/single-parameter-update.md",
      "knowledgeStatus": "partial",
      "reviewStatus": "needs-review",
      "ownerTeam": "",
      "lastReviewedAt": null,
      "relatedFlowIds": ["single-parameter-update-flow"],
      "relatedCanonicalIds": [
        "single-parameter-update-step-1",
        "single-parameter-update-step-2"
      ],
      "claims": [
        {
          "id": "single-parameter-update-module",
          "statement": "此頁面相關 Core 元件屬於事件設置模組，Page Type 為 List。",
          "status": "observed",
          "evidence": [
            { "type": "canonical-id", "ref": "single-parameter-update-step-1", "url": "https://www.figma.com/design/UX9EY190SGnpNiowHlwiUB?node-id=121-294670" }
          ]
        },
        {
          "id": "single-parameter-update-responsive",
          "statement": "相關 Step 元件提供 PC／Tablet 與 Mobile 版型。",
          "status": "observed",
          "evidence": [
            { "type": "canonical-id", "ref": "single-parameter-update-step-1", "note": "Property 1 Variant 提供 PC&Tablet 與 Mobile" }
          ]
        },
        {
          "id": "single-parameter-update-uses-step-flow",
          "statement": "此頁面由 Step 1～2 組成單一循序更新流程，且一次只顯示一個作用中的 Step。",
          "status": "confirmed",
          "evidence": [
            { "type": "canonical-id", "ref": "single-parameter-update-step-1" },
            { "type": "canonical-id", "ref": "single-parameter-update-step-2" },
            { "type": "human-review", "ref": "Codex task confirmation", "note": "使用者確認兩個 Step 屬於同一流程，且一次只顯示一個作用中的 Step。" }
          ],
          "rationale": "連續 Step 命名形成候選流程，並已取得使用者人工確認。",
          "reviewer": "User confirmation in Codex task",
          "reviewedAt": "2026-09-23"
        },
        {
          "id": "single-parameter-update-primary-role",
          "statement": "此頁面的主要使用角色尚未確認。",
          "status": "unknown",
          "evidence": [],
          "openQuestionId": "PQ-0023"
        },
        {
          "id": "single-parameter-update-entry-permission",
          "statement": "此頁面的進入方式、可更新範圍與權限條件尚未確認。",
          "status": "unknown",
          "evidence": [],
          "openQuestionId": "PQ-0024"
        },
        {
          "id": "single-parameter-update-success-destination",
          "statement": "更新成功後的導向與顯示結果尚未確認。",
          "status": "unknown",
          "evidence": [],
          "openQuestionId": "PQ-0025"
        }
      ]
    }
  ],
  "flows": [
    {
      "flowId": "create-event-main-category-flow",
      "titleZh": "新增事件主類別流程",
      "titleEn": "Create Event Main Category Flow",
      "moduleId": "database-management",
      "path": "product/v1.0/flows/create-event-main-category-flow.md",
      "knowledgeStatus": "partial",
      "reviewStatus": "needs-review",
      "ownerTeam": "",
      "lastReviewedAt": null,
      "relatedPageIds": ["create-event-main-category"],
      "relatedCanonicalIds": [
        "create-event-main-category-step-1",
        "create-event-main-category-step-2",